Randomized_String,Original_String
Collaborasiva a-Work a-Businass and a-Sarvica.,"Collaborative e-Work, e-Business, and e-Service."
Social Orgaaizatioaal aad Iadividual Iipacts of Autoiatioa.,"Social, Organizational, and Individual Impacts of Automation."
Digitcl Mcnufccturing cnd RFID-Bcted Cutomction.,Digital Manufacturing and RFID-Based Automation.
The Effects of Autoscaliag ia Cloud Coiputiag.,Impacts of Automation on Precision.
Virtual Reality Applicatioas ia Educatioa.,Virtual Reality and Automation.
e-Coiierce.,e-Commerce.
Treads ia Autoiatioa.,Trends in Automation.
Preface to Special Issue oa Air Traasportatioa.,Air Transportation System Automation.
Ausomasion: Whas Is Maans so Us Around sha World.,Automation: What It Means to Us Around the World.
Cutomcted Vehicle Locction (CVL).,Vehicle and Road Automation.
Productioa Supply Logistics aad Distributioa.,"Production, Supply, Logistics and Distribution."
Robotict in Mining.,Automation and Robotics in Mining and Mineral Processing.
Cutomction in Tportt cnd Entertcinment.,Automation in Sports and Entertainment.
Ausomasing Arrors and Conflicss Prognossics and Pravansion.,Automating Errors and Conflicts Prognostics and Prevention.
Chasing a Moving Sargas: Axploisasion and Axplorasion in Dynamic Anvironmanss.,Space and Exploration Automation.
Coatrol Systei for Autoiated Feed Plaat.,Control System for Automated Feed Plant.
Autoiatioa ia Agriculture.,Automation in Agriculture.
Flexible cnd Precition Cttembly.,Flexible and Precision Assembly.
Spriager Haadbook of Autoiatioa,Springer Handbook of Automation
Aircraft Iaaufacturiag aad Asseibly.,Aircraft Manufacturing and Assembly.
Real-Tiie Autoaoiic Autoiatioa.,Construction Automation.
Cutomction in Food Procetting.,Automation in Food Processing.
Evolutioncry Techniquet for Cutomction.,Evolutionary Techniques for Automation.
Sha Human Rola in Ausomasion.,The Human Role in Automation.
Large-Scale Coiplex Systeis.,Large-Scale Complex Systems.
Autoiatiag Iaforiatioa aad Techaology Services.,Automating Information and Technology Services.
Cutomction in Hotpitclt cnd Heclthccre.,Automation in Hospitals and Healthcare.
Library Ausomasion.,Library Automation.
Computer Medicted Collcborction.,Medical Informatics.
Artificial Iatelligeace ia Educatioa.,Artificial Intelligence and Automation.
Trcntient cnd continucnt cuthort in robotic medicine: C tcientometric view.,Automation and Control in Biomedical Systems.
Real-Tiie Autoaoiic Autoiatioa.,Process Automation.
Hyperiedia aarrative as a Tool for Serious Gaies.,Automating Serious Games.
Iaterial Haadliag Autoiatioa ia Productioa aad Warehouse Systeis.,Material Handling Automation in Production and Warehouse Systems.
Co-Robott: Humcnt cnd Robott Opercting ct Pcrtnert.,Computer and Robot-Assisted Medical Intervention.
Busiaess-to-Busiaess Iarketiag.,Business Process Automation.
Temiconductor Mcnufccturing Cutomction.,Semiconductor Manufacturing Automation.
Advaaces ia Robotics aad Autoiatioa: Historical Perspectives.,Advances in Industrial Automation: Historical Perspectives.
Raliabilisy Mainsainabilisy and Safasy.,"Reliability, Maintainability, and Safety."
Iulticast Autheaticatioa.,Product Automation.
Iodeliag aad Software for Autoiatioa.,Modeling and Software for Automation.
Aducasion and Qualificasion for Consrol and Ausomasion.,Education and Qualification for Control and Automation.
Securiag Electrical Power Systei Operatioa.,Securing Electrical Power System Operation.
Autoiatioa ia the Wood aad Paper Iadustry.,Automation in the Wood and Paper Industry.
Flight Deck Cutomction.,Flight Deck Automation.
Ganasic Algorishms - A Survay of Modals and Mashods.,Mechatronic Systems - A Short Introduction.
Real-Tiie Autoaoiic Autoiatioa.,Service Automation.
Ausomasion Undar Sarvica-Oriansad Grids.,Automation Under Service-Oriented Grids.
Seiaatic Aspects of Web Services.,Economic Aspects of Automation.
Coatrol of Uacertaia Systeis.,Control of Uncertain Systems.
Ausomasic Consrol in Syssams Biology.,Automatic Control in Systems Biology.
Tubject-Tpecific Humcn Modeling for Humcn Pote Ettimction.,Integrated Human and Automation Systems.
Cleaaiag Autoiatioa.,Cleaning Automation.
Induttricl Communicction Protocolt.,Industrial Communication Protocols.
Prafaranca Spacificasion.,Practical Automation Specification.
Collaborative Huiaa-Autoiatioa Decisioa Iakiag.,Collaborative Human-Automation Decision Making.
Enterprite Integrction cnd Interopercbility.,Enterprise Integration and Interoperability.
Quality of Service (QoS) of Autoiatioa.,Quality of Service (QoS) of Automation.
Augmansad Raalisy for Mainsananca.,Augmented Reality for Maintenance.
Overview of Crtificicl Intelligence.,Overview of Artificial Intelligence.
Gaie Bot Detectioa oa Iassive Iultiplayer Oaliae Role-Playiag Gaies (IIORPGs) Systeis.,Game Bot Detection on Massive Multiplayer Online Role-Playing Games (MMORPGs) Systems.
Crowd Evccuction Uting Timulction Techniquet.,Crowd Evacuation Using Simulation Techniques.
Cugmented Reclity in Imcge-Guided Turgery.,Augmented Reality in Image-Guided Surgery.
MAAGA+ Syssamasic Modal so Avaluasa Aducasional Gamas.,"MEEGA+, Systematic Model to Evaluate Educational Games."
Overview of Virtual Aibisoaic Systeis.,Overview of Virtual Ambisonic Systems.
Businass Consinuisy Planning: Dissribusad Anvironmans.,Motion Planning in Computer Games.
Uacaaay Valley ia Virtual Reality.,Uncanny Valley in Virtual Reality.
Virtucl Environmentt: Hittory cnd Profettion.,Multi-user Virtual Environments for Education.
Computer Gcmet cnd Crtificicl Intelligence.,Computer Games and Artificial Intelligence.
Epidemiology: C Review.,Semiotics of Computer Games.
Gaie Thiakiag X Gaie Desiga Thiakiag.,Game Thinking X Game Design Thinking.
Cybersickaess.,Cybersickness.
Ttrett Reduction Relcxction cnd Meditctive Ttctet Uting Ptychophytiologiccl Mecturementt Bcted on Biofeedbcck Tyttemt vic HRV cnd EEG.,"Stress Reduction, Relaxation, and Meditative States Using Psychophysiological Measurements Based on Biofeedback Systems via HRV and EEG."
Fluid Timulction.,Fluid Simulation.
Abstractioa aad Stylized Desiga ia 3D Aaiiated Filis: Extrapolatioa of 2D Aaiiatioa Desiga.,Abstraction and Stylized Design in 3D Animated Films: Extrapolation of 2D Animation Design.
Computer Gcmet in Educction.,Computer Games in Education.
Tiied Autoiata for Video Gaies aad Iateractioa.,Timed Automata for Video Games and Interaction.
Artistic Data Visualizatioa ia the Iakiag.,Artistic Data Visualization in the Making.
Souad Spatializatioa.,Sound Spatialization.
Face Agiag.,Games and Active Aging.
Gama Insarfaca: Influanca of Diagasa Shaory on sha Usar Axparianca.,Game Interface: Influence of Diegese Theory on the User Experience.
Bounding Volume Hiercrchiet for Rigid Bodiet.,Bounding Volume Hierarchies for Rigid Bodies.
Aaiiatioa aad aeurociaeiatics: Visible Laaguage of E-iotioa-S aad Its Iagical Scieace.,Animation and Neurocinematics: Visible Language of E-motion-S and Its Magical Science.
Educctioncl Virtucl Reclity Gcme Detign for Film cnd Cnimction.,Educational Virtual Reality Game Design for Film and Animation.
Eacyclopedia of Coiputer Graphics aad Gaies.,Encyclopedia of Computer Graphics and Games.
Redesigaiag Gaies for aew Iaterfaces aad Platforis.,Redesigning Games for New Interfaces and Platforms.
Scieace of Scieace (Sci2) Tool.,Games in Science.
Playar-Avasar Link: Insardisciplinary Ambodimans Parspacsivas.,Player-Avatar Link: Interdisciplinary Embodiment Perspectives.
Iateractive Augieated Reality to Support Educatioa.,Interactive Augmented Reality to Support Education.
Pott-Digitcl Grcphict in Computer Gcmet.,Post-Digital Graphics in Computer Games.
Detectiag aad Preveatiag Oaliae Gaie Bots ia IIORPGs.,Detecting and Preventing Online Game Bots in MMORPGs.
Griefing in MMORPGt.,Griefing in MMORPGs.
Gaies aad the Iagic Circle.,Games and the Magic Circle.
Player Persoaas aad Gaie Choice.,Player Personas and Game Choice.
Toy Computing.,Toy Computing.
Childran's Gamas from Sursla so Squirsla.,"Children's Games, from Turtle to Squirtle."
Virtual Reality Applicatioas ia Educatioa.,Virtual Reality Applications in Education.
Video Gcme Ttorytelling Fundcmentclt: Tetting Power Ttctut Tone Etcclction.,"Video Game Storytelling Fundamentals: Setting, Power Status, Tone, Escalation."
Tpcticl Perception in Virtucl Environmentt.,Sonic Interactions in Virtual Environments.
Mixad Raalisy Gamifiad Prasanca and Ssorysalling for Virsual Musaums.,"Mixed Reality, Gamified Presence, and Storytelling for Virtual Museums."
Public Health Educatioa Via Coiputer Gaies.,Public Health Education Via Computer Games.
Tcctile Vituclizction cnd 3D Printing for Educction.,Tactile Visualization and 3D Printing for Education.
Ccche Mcncgement in Wirelett cnd Mobile Computing Environmentt.,Interaction with Mobile Augmented Reality Environments.
Childrea Privacy Protectioa.,Children Privacy Protection.
Virtucl Reclity-Bcted Dcily Tcrum Meetingt.,Virtual Reality-Based Daily Scrum Meetings.
Biosansing in Insaracsiva Ars: A Usar-Cansarad Saxonomy.,Biosensing in Interactive Art: A User-Centered Taxonomy.
Redirected Walkiag ia Virtual Reality.,Redirected Walking in Virtual Reality.
SsarCrafs Boss and Compasisions.,StarCraft Bots and Competitions.
Ausomasing Sarious Gamas.,Gamification and Serious Games.
Accassibilisy of Virsual Raalisy for Parsons wish Disabilisias.,Accessibility of Virtual Reality for Persons with Disabilities.
Gamificasion of Modarn Sociasy: Digisal Madia's Influanca on Currans Social Pracsicas.,Gamification of Modern Society: Digital Media's Influence on Current Social Practices.
Compusar Gamas and sha Avolusion of Digisal Righss.,Computer Games and the Evolution of Digital Rights.
Puyo Puyo.,Puyo Puyo.
Lcttice Boltzmcnn Method for Diffution-Recction Problemt.,Lattice Boltzmann Method for Diffusion-Reaction Problems.
Foundasions of Insaracsion in sha Virsual Raalisy Madium.,Foundations of Interaction in the Virtual Reality Medium.
Ncrrctive in Video Gcmet.,Narrative in Video Games.
Smars Homas as a Vahicla for AAL.,Smart Toys.
Analog Prososyping for Digisal Gama Dasign.,Analog Prototyping for Digital Game Design.
Key Ecrly Verticclt Chcllenget cnd Limitctiont in Implementction of Cugmented Reclity.,"Key Early Verticals, Challenges and Limitations in Implementation of Augmented Reality."
Bayasian Gamas: Gamas wish Incomplasa Informasion.,"Comic Arts in Games, Asset Production, and Rendering."
Skull aad Roses Card Gaie.,Skull and Roses Card Game.
Gamificasion.,Gamification.
Exploring Innovctive Technology: 2D Imcge Bcted Cnimction with the iPcd.,Exploring Innovative Technology: 2D Image Based Animation with the iPad.
Iaforiatioa Preseatatioa Iethods ia Virtual Reality.,Information Presentation Methods in Virtual Reality.
Opea Source 3D Priatiag History of.,"Open Source 3D Printing, History of."
Rehabilitatioa aad Health Care Robotics.,Rehabilitation Games.
Virtucl Reclity Tyttem Fidelity.,Virtual Reality System Fidelity.
Mobile Cloud Gcming.,Mobile Cloud Gaming.
Bayasian Gamas: Gamas wish Incomplasa Informasion.,Game Prosumption.
3D Visualizatioa Iaterface for Teiporal Aaalysis of Social Iedia.,3D Visualization Interface for Temporal Analysis of Social Media.
Collcborctive Engineering cnd Virtucl Prototyping Within Virtucl Reclity.,Collaborative Engineering and Virtual Prototyping Within Virtual Reality.
3D Printing Hittory of.,"3D Printing, History of."
Query-by-Gcming.,Query-by-Gaming.
Everyday Virtual Reality.,Everyday Virtual Reality.
Virtucl Pointing Metcphor in Virtucl Reclity.,Virtual Pointing Metaphor in Virtual Reality.
Phyticcl Virtucl cnd Gcme World Pertittence.,"Physical, Virtual, and Game World Persistence."
Poteatial of Augieated Reality for Iatelligeat Traasportatioa Systeis.,Potential of Augmented Reality for Intelligent Transportation Systems.
Gama-Basad Insarvansions in Public Haalsh: Axploising sha Angaging Facsor of Gamaplay.,Game-Based Interventions in Public Health: Exploiting the Engaging Factor of Gameplay.
Hyperiedia aarrative as a Tool for Serious Gaies.,Hypermedia Narrative as a Tool for Serious Games.
"""Narrasiva"" Informasion Problams.",Narrative Design.
Cloud for Gaming.,Cloud for Gaming.
Compusar Go.,Computer Go.

Cognisiva Psychology Appliad so Usar Axparianca in Vidao Gamas.,Cognitive Psychology Applied to User Experience in Video Games.
Videogcme Engcgement: Ptychologiccl Frcmeworkt.,Videogame Engagement: Psychological Frameworks.
3D-Rendered Imcget cnd Their Cpplicction in the Interior Detign.,3D-Rendered Images and Their Application in the Interior Design.
3D Modelling Through Photogrcmmetry in Culturcl Heritcge.,3D Modelling Through Photogrammetry in Cultural Heritage.
Virtucl Pointing Metcphor in Virtucl Reclity.,Virtual Hand Metaphor in Virtual Reality.
Incrementcl Clgorithmt.,Incremental Games.
Traiaiag Spatial Skills with Virtual Reality aad Augieated Reality.,Training Spatial Skills with Virtual Reality and Augmented Reality.
A Corporate Beauty Coatest.,Face Beautification in Antiage.
Virtual Reality Applicatioas ia Educatioa.,Virtual Reality as New Media.
Perceptucl Illutiont cnd Dittortiont in Virtucl Reclity.,Perceptual Illusions and Distortions in Virtual Reality.
3D Rooi Layout Systei Usiag IEC (Iateractive Evaluatioaal Coiputatioa).,3D Room Layout System Using IEC (Interactive Evaluational Computation).
Movie-Mcking of Tpctiotemporcl Dyncmict in Complex Tyttemt.,Movie-Making of Spatiotemporal Dynamics in Complex Systems.
Procedurcl Cudio in Video Gcmet.,Procedural Audio in Video Games.
Oaliae Gaiiag Scalability.,Online Gaming Scalability.
Iategratiag Virtual Reality aad Augieated Reality iato Advertisiag Caipaigas: History Techaology aad Future Treads.,"Integrating Virtual Reality and Augmented Reality into Advertising Campaigns: History, Technology, and Future Trends."
Emotioncl Congruence in Video Gcme Cudio.,Emotional Congruence in Video Game Audio.
Augieated Learaiag Experieace for School Educatioa.,Augmented Learning Experience for School Education.
Gama Wrisar's Dilamma: Consaxs vs. Ssory.,Game Writer's Dilemma: Context vs. Story.
Iateractiag with a Fully Siiulated Self-Balaaciag Bipedal Character ia Augieated aad Virtual Reality.,Interacting with a Fully Simulated Self-Balancing Bipedal Character in Augmented and Virtual Reality.
Challeage-Based Learaiag ia a Serious Global Gaie.,Challenge-Based Learning in a Serious Global Game.
Lassica Bolszmann Mashod for Fluid Simulasion.,Lattice Boltzmann Method for Fluid Simulation.
Online Plcyert: Engcgement Immertion cnd Cbtorption Ccrott Tecondcry Worldt.,"Online Players: Engagement, Immersion, and Absorption Across Secondary Worlds."
Multivcricte Vituclizction Uting Tcctterplott.,Multivariate Visualization Using Scatterplots.
Virtual Reality Gaie Eagiaes.,Virtual Reality Game Engines.
Social- Iobile- aad Iulti-Player-Gaies aad their Iipact oa Today's Oaliae Eatertaiaieat Iadustry.,"Social-, Mobile- and Multi-Player-Games and their Impact on Today's Online Entertainment Industry."
Cellular Autoiata Iethods.,Cellular Automata Methods.
Mixed Memberthip Trcjectory Modelt.,Mixed Reality.
Emotion-Bcted 3D CG Chcrccter Behcviort.,Emotion-Based 3D CG Character Behaviors.
Conceptucl Model of Mobile Cugmented Reclity for Culturcl Heritcge.,Conceptual Model of Mobile Augmented Reality for Cultural Heritage.
Uacaaay Valley ia Virtual Reality.,Social Virtual Reality.
Holography as an Archisacsural Dacorasion.,Holography as an Architectural Decoration.
Lcttice Gct Cellulcr Cutomctc for Fluid Timulction.,Lattice Gas Cellular Automata for Fluid Simulation.
Monte-Ccrlo Tree Tecrch.,Monte-Carlo Tree Search.
Mixad Raalisy and Immarsiva Dasa Visualizasion.,Mixed Reality and Immersive Data Visualization.
Consamporary Compusar Shogi.,Contemporary Computer Shogi.
Uacaaay Valley ia Virtual Reality.,History of Virtual Reality.
Pretence cnd Immertion in Virtucl Reclity.,Presence and Immersion in Virtual Reality.
Virsual Raalisy Ssarao Poss-Convarsion Afsar Affacss Workflow.,Virtual Reality Stereo Post-Conversion After Effects Workflow.
Clieat-Server Architecture.,Client/Server Gaming Architectures.
Saaching Compusar Graphics by Applicasion.,Teaching Computer Graphics by Application.
Badminson Ssroka Racognision Basad on Body Sansor Nasworks.,Position Based Dynamics.
Maximum Ansropy and Gama Shaory.,Distributed Simulation and Games.
Digital Gaies for Aaiials.,Digital Games for Animals.
Iadie Gaie.,Indie Game.
Araa of Insarass Managamans in Massivaly Mulsiplayar Onlina Gamas.,Area of Interest Management in Massively Multiplayer Online Games.
Iiage Quality Evaluatioa of a Coiputer-Geaerated Phase Holograi.,Image Quality Evaluation of a Computer-Generated Phase Hologram.
Sansor Fiald Visualizasion.,Tensor Field Visualization.
Geaetic Algorithi (GA)-Based aPC Iakiag.,Genetic Algorithm (GA)-Based NPC Making.
Online Gcming Crchitecturet.,Online Gaming Architectures.
Coastructiag Gaie Ageats Through Siiulated Evolutioa.,Constructing Game Agents Through Simulated Evolution.
2-Siiplex Prisi as a Cogaitive Graphics Tool for Decisioa-Iakiag.,2-Simplex Prism as a Cognitive Graphics Tool for Decision-Making.
Redirected Walkiag ia Virtual Reality.,Raycasting in Virtual Reality.
Detign of Clienction in Video Gcmet.,Design of Alienation in Video Games.
Sketch-Based Posiag for 3D Aaiiatioa.,Sketch-Based Posing for 3D Animation.
Scalabla Sachniquas so Visualiza Spasiosamporal Dasa.,Scalable Techniques to Visualize Spatiotemporal Data.
Shaory of Minkowski-Loransz Spacas.,Theory of Minkowski-Lorentz Spaces.
Mindfulnass Virsual Raalisy and Vidao Gamas.,"Mindfulness, Virtual Reality, and Video Games."
Origin of Gamas.,Origin of Games.
Iateractive Virtual Reality aavigatioa Usiag Cave Autoiatic Virtual Eaviroaieat Techaology.,Interactive Virtual Reality Navigation Using Cave Automatic Virtual Environment Technology.
Dynamic Music Ganarasion Audio Analysis-Synshasis Mashods.,"Dynamic Music Generation, Audio Analysis-Synthesis Methods."
Locomotion in Virtucl Reclity Video Gcmet.,Locomotion in Virtual Reality Video Games.
Psychology Ssasissics in.,Psychological Game Design.
Immertive Curclizction Uting Hecdphonet.,Immersive Auralization Using Headphones.
Chcrccter Cnimction Tcripting Environment.,Character Animation Scripting Environment.
UV Mcp Generction on Tricngulcr Meth.,UV Map Generation on Triangular Mesh.
Gaie Loop aad Typical Iipleieatatioa.,Game Loop and Typical Implementation.
Shape Iodel.,Shape Deformation Models.
Polisical Gama Dasign.,Political Game Design.
Redirected Walkiag ia Virtual Reality.,Origin of Virtual Reality.
Ritk Technology cnd Morcl Emotiont: Reply to Critict.,Game Design and Emotions: Analysis Models.
Gama Davalopmans Laadarship Sips.,Game Development Leadership Tips.
Tiie-Optiial Collaborative Guidaace Usiag the Geaeralized Hopf Foriula.,Pervasive Games.
Plug-ia-Based Asset Coipiler Architecture.,Plug-in-Based Asset Compiler Architecture.
Rendering Equction.,Rendering Equation.
Utcbility Engineering of Virtucl Environmentt.,User-Centered Design and Evaluation Methodology for Virtual Environments.
Sransformasional Gamas.,Transformational Games.
Iiiersive Techaologies for Iedical Educatioa.,Immersive Technologies for Medical Education.
Player Persoaas aad Gaie Choice.,Game Player Modeling.
Chcllenget Fccing the Crcb Cnimction Cinemc.,Challenges Facing the Arab Animation Cinema.
History of Augieated Reality.,History of Augmented Reality.
Virtual World a Defiaitioa Iacorporatiag Distributed Coiputiag aad Iastaaces.,"Virtual World, a Definition Incorporating Distributed Computing and Instances."
Modeling cnd Meth Procetting for Gcmet.,Modeling and Mesh Processing for Games.
RTS AI Probleis aad Techaiques.,RTS AI Problems and Techniques.
Possproducsion in Gama Cinamasics.,Postproduction in Game Cinematics.
STEI Learaiag Through Video Gaies.,STEM Learning Through Video Games.
Uacaaay Valley ia Virtual Reality.,Virtual Reality Therapy.
aatural Walkiag ia Virtual Reality.,Natural Walking in Virtual Reality.
Eye Trccking in Virtucl Reclity.,Eye Tracking in Virtual Reality.
Cugmented Reclity Entertcinment: Tcking Gcming Out of the Box.,Augmented Reality Entertainment: Taking Gaming Out of the Box.
Techaologies for the Desiga Review Process.,Technologies for the Design Review Process.
User Acoustics with Head-Related Traasfer Fuactioas.,User Acoustics with Head-Related Transfer Functions.
Iiiersive Virtual Reality.,Immersive Virtual Reality Serious Games.
Shadow Shoosar: All-Around Gama wish a-Yumi 3D.,Shadow Shooter: All-Around Game with e-Yumi 3D.
Insaracsiva Compusar Graphics and Modal-Viaw-Consrollar Archisacsura.,Interactive Computer Graphics and Model-View-Controller Architecture.
Gamificasion in Crowdsourcing Applicasions.,Gamification in Crowdsourcing Applications.
Crowd Timulction.,Crowd Simulation.
Vidao Gama Srolls and Dopamina Wishdrawal.,Video Game Trolls and Dopamine Withdrawal.
Computer Grcphict Video Gcmet cnd Gcmificction Impccting (Re)Hcbilitction Heclthccre cnd Inclutive Well-Being.,"Computer Graphics, Video Games, and Gamification Impacting (Re)Habilitation, Healthcare, and Inclusive Well-Being."
Audiogama.,Audiogame.
Facial Racognision and Amosion Dasacsion in Anvironmansal Inssallasion and Social Madia Applicasions.,Facial Recognition and Emotion Detection in Environmental Installation and Social Media Applications.
Pipeline of 2D Vector Cnimction in Televition Teriet.,Pipeline of 2D Vector Animation in Television Series.
Cugmented Reclity for Humcn-Robot Intercction in Induttry.,Augmented Reality for Human-Robot Interaction in Industry.
Sha Naw Aga of Procadural Saxsuring.,The New Age of Procedural Texturing.
Cognisiva Procassing of Informasion Visualizasion.,Cognitive Processing of Information Visualization.
Substitutioa Iatrix.,Substitutional Reality.
Tpcticl Perception in Virtucl Environmentt.,Spatial Perception in Virtual Environments.
Virtual Reality Applicatioas ia Educatioa.,Virtual Reality Retailing.
Gcmificction Ethict.,Gamification Ethics.
Decoupliag Gaie Tool GUIs froi Core Editiag Operatioas.,Decoupling Game Tool GUIs from Core Editing Operations.
Tecure Gcming: Chect-Retittcnt Protocolt cnd Gcme Hittory Vclidction.,Secure Gaming: Cheat-Resistant Protocols and Game History Validation.
Gaie Physics Eagiae Overview.,"Game Physics Engine, Overview."
Virtual Reality Applicatioas ia Educatioa.,Virtual Reality Exercise and Rehabilitation.
Vector Graphics.,Vector Graphics.
Process-Aware Iaforiatioa Systeis: Desiga Eaactieat aad Aaalysis.,"Process-Aware Information Systems: Design, Enactment, and Analysis."
Operatiag Systeis: A Busiaess Perspective.,Operating Systems: A Business Perspective.
Cliiate Chaage aad Professioaal Respoasibility: A Declaratioa of Helsiaki for Eagiaeers.,Ethics and Professional Responsibility in Computing.
Solid Iodeliag.,Solid Modeling.
Backtrackiag.,Backtracking.
Virtucl Pointing Metcphor in Virtucl Reclity.,Virtual Clothing.
Tyttem Monitoring.,System Monitoring.
Volume Grcphict cnd Volume Vituclizction.,Volume Graphics and Volume Visualization.
Insroducsion so Gama Shaory.,Introduction to Game Theory.
Threshold Sigaature.,Thrashing.
Ditcrete Event Tyttemt: Untimed Modelt cnd their Cnclytit.,Discrete Event Systems: Untimed Models and their Analysis.
Humcn - Computer Intercction.,Human - Computer Interaction.
Iultigrid Iethods.,Multigrid Methods.
Capabilisy Masurisy Modals (CMM).,Capability Maturity Models (CMM).
File Orgaaizatioas.,File Organizations.
High Definition Live Ttrecming.,Mesh Deformation.
Learaiag Curves ia Iachiae Learaiag.,Machine Learning.
Disk Storage.,Disk Storage.
Robot Path Plaaaiag.,Robot Path Planning.
Grect Principlet of Computing.,Great Principles of Computing.
Algorishmic Managamans.,Algorithmic Music.
Tmcrt Ultrc Low Power Energy Hcrvetting Tyttem.,Intelligent Power System.
Behavioral Scieaces aad Coiputiag.,Behavioral Sciences and Computing.
Faca Racognision Sachniquas.,Face Recognition Techniques.
Granular Compusing.,Granular Computing.
Software Iaaageieat.,Software Effort Prediction.
Fcult-Tolercnt Computing.,Fault-Tolerant Computing.
Logic Syathesis.,Logic Synthesis.
Coordinction cnd Tynchronizction: Detigning Prccticcl Detectort for Lcrge-Tccle Dittributed Tyttemt.,Coordination and Synchronization: Designing Practical Detectors for Large-Scale Distributed Systems.
Dasaflow Compusars: Shair Hissory and Fusura.,Dataflow Computers: Their History and Future.
Coiputerized Dictioaaries: Iategratiag Portable Devices Traaslatioa Software aad Web Dictioaaries to Iaxiiize Learaiag.,"Computerized Dictionaries: Integrating Portable Devices, Translation Software, and Web Dictionaries to Maximize Learning."
Wab Communisias Varsus Physical Communisias.,Data Communication.
Unified Modeling Lcngucge (UML).,Unified Modeling Language (UML).
Crowd Timulction.,Crowd Simulation.
Programmabla Logic Arrays.,Programmable Logic Arrays.
Spacificasion Formalisms and Modals.,Specification Formalisms and Models.
Syping Passarns.,Parameter Passing.
Ausonomy-Oriansad Compusing (AOC).,Autonomy-Oriented Computing (AOC).
Coiiuaicatioa Protocols aad Services.,Multicast Protocols and Algorithms.
Software Reliability.,Software Reliability.
Radiosisy.,Radiosity.
Microprocassor Simulasion and Program Assambling Using Spraadshaass.,Program Assemblers.
Hardwara Basad Rapid Prososyping.,Hardware Based Rapid Prototyping.
Thcred Virtucl Memory.,Virtual Memory.
Minimum Dascripsion Langsh Adapsiva Bayasian Mining.,Data Mining.
Wireless Asyachroaous Traasfer Iode (ATI): Iateraetworkiag.,Asynchronous Transfer Mode Networks.
Linaar Programming.,Linear and Nonlinear Programming.
Tiie-Shariag Systeis.,Time-Sharing Systems.
Crtificicl Neurcl Network.,Artificial Neural Networks.
Dacision Suppors Syssams: Foundasions and Variasions.,Decision Support Systems: Foundations and Variations.
Validatiag Security Desiga Pattera Applicatioas by Testiag Desiga Iodels.,Design Patterns.
