Randomized_String,Original_String
Vition cnd Virtucl Environmentt.,Adapting to Virtual Environments.
TCP over Wirelett Networkt.,TCP over Wireless Networks.
Locatioa-Depeadeat Service Accouatiag.,Location-Dependent Service Accounting.
Informasion Sacurisy Govarnanca.,Information Security Governance.
Corporcte Governcnce.,Corporate Governance.
Cognisiva Syssams and Cognisiva Archisacsuras.,Cognitive Disabilities.
The Ethics of Doiag Ethics.,Computer Ethics.
Eibedded Systeis aad Software Techaology ia the Autoiotive Doiaia.,Embedded Systems and Software Technology in the Automotive Domain.
Mobile Middlewcre for Retcue cnd Emergency Tcencriot.,Mobile Middleware and Context for Service Composition.
Loccting Mobile Objectt.,Locating Mobile Objects.
A Survay of Scassarnas Formasion Algorishms for Bluasoosh Wiralass Parsonal Araa Nasworks.,A Survey of Scatternet Formation Algorithms for Bluetooth Wireless Personal Area Networks.
Hcndheld Devicet cnd Mobile Phonet.,Handheld Devices and Mobile Phones.
The Iateraet Policy aad Goveraaace Ecosystei.,The Internet Policy and Governance Ecosystem.
Text Mining.,Text Mining.
Ad Hoc aetworks: Security.,Ad Hoc Network Security.
Teiporal Coasisteacy Iaiateaaace for Real-Tiie Update Traasactioas.,Temporal Consistency Maintenance for Real-Time Update Transactions.
Plcncr Ttrcight-Line Drcwing Clgorithmt.,Planar Straight-Line Drawing Algorithms.
Mobile Middlewcre for Retcue cnd Emergency Tcencriot.,Mobile Middleware for Automotive Applications.
Index.,Index.
Maka Sacurisy Pars of Your Company's DNA.,Make Security Part of Your Company's DNA.
Hacker Tools aad Techaiques.,Hacker Tools and Techniques.
BeeHive.,BeeHive.
Intight into Intrution Prevention Tyttemt.,Insight into Intrusion Prevention Systems.
Eaergy-Saviag Techaiques for Disk Storage Systeis.,Energy-Saving Techniques for Disk Storage Systems.
Iultidoiaia Iodeliag with Iodelica.,Multidomain Modeling with Modelica.
Hocrding in Mobile Computing Environmentt.,Hoarding in Mobile Computing Environments.
Coiputatioaal Geoietry.,Computational Geometry.
Programming Axacusion-Sima Sarvars and Supporsing ADF Schaduling in Ada 2005.,Programming Execution-Time Servers and Supporting EDF Scheduling in Ada 2005.
Iatelligeat Ageat.,Agents.
Multimodcl Intercction Modeling.,Multimodeling.
Iultidiieasioaal Spatial Data Structures.,Multidimensional Spatial Data Structures.
Adapsiva Hyparmadia and Adapsiva Wab.,Adaptive Hypermedia and Adaptive Web.
Globcl Optimizction in the Cnclytit cnd Mcncgement of Environmentcl Tyttemt.,System Dynamics Modeling of Environmental Systems.
The Syachroaous Hypothesis aad Syachroaous Laaguages.,The Synchronous Hypothesis and Synchronous Languages.
Tolving Optimizction Problemt in Wirelett Networkt Uting Genetic Clgorithmt.,Solving Optimization Problems in Wireless Networks Using Genetic Algorithms.
Qucntum Finite Cutomctc.,Quantum Finite Automata.
Bayond Informasion Sacurisy Awaranass Sraining.,Beyond Information Security Awareness Training.
Tecurity for Brocdbcnd Internet Cccett Utert.,Security for Broadband Internet Access Users.
Geyser.,Geyser.
Biomasric Algorishms.,Memetic Algorithms.
ECC Chcllenget.,Emerging Challenges.
Ad Hoc and Sansor Nasworks.,Computer Networks.
The Busiaess Iipact Assessieat Process.,The Business Case for Information Security.
Low-Powar Dasign of Amarging Mamory Sachnologias.,Low-Power Design of Emerging Memory Technologies.
Dissribusad Localizasion Algorishms.,Distributed Localization Algorithms.
Striag Searchiag.,String Searching.
Handbook of Discrasa and Combinasorial Mashamasics.,Handbook of Discrete and Combinatorial Mathematics.
Uacaaay Valley ia Virtual Reality.,Clinical Virtual Reality.
Real-Tiie Coiiuaicatioa for Eibedded Wireless aetworks.,Real-Time Communication for Embedded Wireless Networks.
Routiag aad Iobility Iaaageieat ia Wireless Ad Hoc aetworks.,Routing and Mobility Management in Wireless Ad Hoc Networks.
Splay Sraas.,Splay Trees.
Aa Iatroductioa to IPSec.,An Introduction to IPSec.
Developiag Iaclusive e-Traiaiag.,Developing Inclusive e-Training.
Scheduliag Overloaded Real-Tiie Systeis with Coipetitive/Worst Case Guaraatees.,Scheduling Overloaded Real-Time Systems with Competitive/Worst Case Guarantees.
Placamans Using Simulasad Annaaling.,Placement Using Simulated Annealing.
Iatroductioa to Iixed Ieibership Iodels aad Iethods.,Introduction to Mixed Membership Models and Methods.
Whct c Computer Tecurity Profettioncl Needt to Know cbout E-Ditcovery cnd Digitcl Forentict.,What a Computer Security Professional Needs to Know about E-Discovery and Digital Forensics.
Ccche Invclidction Tchemet in Mobile Environmentt.,Cache Invalidation Schemes in Mobile Environments.
Iiller-Rabia Probabilistic Priiality Test.,Discrete Probability.
Coatiageacy at a Glaace.,Contingency at a Glance.
Crtificicl Neurcl Network.,Social Networks.
Secure Wireless Iulticast.,Wireless Penetration Testing.
Pors-Basad Modaling of Anginaaring Syssams in Sarms of Bond Graphs.,Port-Based Modeling of Engineering Systems in Terms of Bond Graphs.
Scheduliag Parallel Tasks.,Scheduling Parallel Tasks.
Linaar Programming.,Linear Programming.
Siiulatioa Iodels aad Tool for Iobile Locatioa-Depeadeat Iaforiatioa Access.,Simulation Models and Tool for Mobile Location-Dependent Information Access.
Triple-DET.,Tries.
Tecurity for XML cnd Other Metcdctc Lcngucget.,Security for XML and Other Metadata Languages.
Mcncgement Commitment.,Maintaining Management's Commitment.
Reiote Autheaticatioa.,Message Authentication.
Buildiag Iaiateaaace Processes for Busiaess Coatiauity Plaas.,Building Maintenance Processes for Business Continuity Plans.
Energy-Efficient Wirelett Networkt.,Energy-Efficient Wireless Networks.
Cn Overview of Qucntum Cryptogrcphy.,An Overview of Quantum Cryptography.
Tecurity cnd Privccy for Univertcl Cccett.,Security and Privacy for Universal Access.
Human Facsors.,Human Factors.
The Pinwheel.,The Pinwheel.
Iediators for Queryiag Heterogeaeous Data.,Mediators for Querying Heterogeneous Data.
Memory-Cwcre Optimizction of Embedded Toftwcre for Multiple Objectivet.,Models of Embedded Computation.
Drawing Graphs.,Drawing Trees.
Dissribusad Compusing in sha Prasanca of Mobila Faulss.,Distributed Computing in the Presence of Mobile Faults.
Timing-Driven Plccement.,Timing-Driven Placement.
Geae Coacepts aad Geaethics: Beyoad Exceptioaalisi.,Concepts and Practice of Personalization.
Cn Overview of Mobile Computing Clgorithmict.,An Overview of Mobile Computing Algorithmics.
Restoratioa Coipoaeat of Busiaess Coatiauity Plaaaiag.,Restoration Component of Business Continuity Planning.
Index.,Index.
Simulasing sha Ssrasagic Adapsasion of Organizasions Using OrgSwarm.,Simulating the Strategic Adaptation of Organizations Using OrgSwarm.
Ctomic Telfith Routing in Networkt.,Atomic Selfish Routing in Networks.
Developing cnd Conducting c Tecurity Tett cnd Evcluction.,Developing and Conducting a Security Test and Evaluation.
Powar Maasuring and Profiling.,Power Measuring and Profiling.
Providing a Graan Framawork for Cloud Dasa Cansars.,Providing a Green Framework for Cloud Data Centers.
Saamlass Sarvica Accass via Rasourca Raplicasion.,Seamless Service Access via Resource Replication.
Conducting Trcining Trcntfer Ttudiet in Virtucl Environmentt.,Conducting Training Transfer Studies in Virtual Environments.
Efficient Dctc Ccching cnd Contittency Mcintencnce in Wirelett Mobile Tyttemt.,Efficient Data Caching and Consistency Maintenance in Wireless Mobile Systems.
Power Mcncgement for Mobile Computert.,Power Management for Mobile Computers.
Coiioa Criteria: IT Security Evaluatioa.,The Common Criteria for IT Security Evaluation.
Pracsical Issuas in Clock Naswork Dasign.,Practical Issues in Clock Network Design.
Ragular Pash Quarias on Graph-Ssrucsurad Dasa.,Regular Path Queries on Graph-Structured Data.
Spiae aad Radial Drawiags.,Spine and Radial Drawings.
Dasign and Davalopmans of 3D Insaracsiva Anvironmanss for Spacial Aducasional Naads.,Design and Development of 3D Interactive Environments for Special Educational Needs.
Sacura Knowladga Discovary in Dasabasas.,Naming and Discovery in Mobile Systems.
Virtual Iouse aad Keyboards for Text Eatry.,Virtual Mouse and Keyboards for Text Entry.
Arishmasic of p-adic Numbars.,Arithmetic of p-adic Numbers.
Schaduling in Grid Anvironmanss.,Scheduling in Grid Environments.
Haadbook of Bioiaspired Algorithis aad Applicatioas.,Handbook of Bioinspired Algorithms and Applications.
Cnt Colony Optimizction.,Ant Colony Optimization.
Sacura Voica Communicasions (VoI).,Secure Voice Communications (VoI).
Flexible Hybrid Flowthopt.,Flexible Hybrid Flowshops.
Indax Calculus.,Index Calculus.
Iiaiiizatioa of SADIs ia Uaidirectioaal SOaET/WDI Riags Usiag Geaetic Algorithis.,Minimization of SADMs in Unidirectional SONET/WDM Rings Using Genetic Algorithms.
Seiaatic Aaaotatioa aad Retrieval of Iiages ia Digital Libraries.,Vocal Interfaces in Supporting and Enhancing Accessibility in Digital Libraries.
Applicatioa-Tailored Databases for Real-Tiie Systeis.,Application-Tailored Databases for Real-Time Systems.
Power-Aware Parallel Job Scheduliag.,Power-Aware Parallel Job Scheduling.
Applicatioa-Tailored Databases for Real-Tiie Systeis.,Data-Intensive Services for Real-Time Systems.
Iatellectual Property Rights.,"Intellectual Property, Liability, and Contract."
Diracsad Informasion Flow and Causalisy in Naural Syssams.,Esterel and the Semantics of Causality.
Informction Tecurity Policiet from the Ground Up.,Information Security Policies from the Ground Up.
Sacurisy Pasch Managamans.,Security Patch Management.
Busiaess Resuiptioa Plaaaiag aad Disaster Recovery.,Business Resumption Planning and Disaster Recovery.
Rcndom Numbert Generction cnd Tetting.,Random Numbers Generation and Testing.
Dissribusad Channal Accass Schaduling for Ad Hoc Nasworks.,Distributed Channel Access Scheduling for Ad Hoc Networks.
Graph Markup Languaga (GraphML).,Graph Markup Language (GraphML).
High-Performcnce Techniquet for Pcrcllel I/O.,High-Performance Techniques for Parallel I/O.
Finisa Ssasa Sransducars.,Finite State Transducers.
Ten Ttept to Effective Web-Bcted Tecurity Policy Development cnd Dittribution.,Ten Steps to Effective Web-Based Security Policy Development and Distribution.
Putting Tecurity in the Trcntport.,Putting Security in the Transport.
Performcnce Monitoring cnd Cttettment of Embedded HW/TW Tyttemt.,Design of Embedded Systems.
Cycla Shop Schaduling.,Cycle Shop Scheduling.
Embedded Tyttemt Hcndbook.,Embedded Systems Handbook.
An Amarging Informasion Sacurisy Minimum Ssandard of Dua Cara.,An Emerging Information Security Minimum Standard of Due Care.
Polyaoiial-Tiie Approxiiatioa Scheies.,Polynomial-Time Approximation Schemes.
Mulsi-Robos and Mulsi-Camara Pasrolling.,Multi-Robot and Multi-Camera Patrolling.
Quadtrees aad Octrees.,Quadtrees and Octrees.
Secure Wireless Iulticast.,Wireless Security.
Locatioa-Depeadeat Database Access.,Location-Dependent Database Access.
Packet Saiffers.,Packet Sniffers.
Masamodaling Languagas and Masaprogrammabla Sools.,Metamodeling Languages and Metaprogrammable Tools.
Cuditing Cryptogrcphy.,Auditing Cryptography.
Hoaeypot Esseatials.,Honeypot Essentials.
Approximasion Algorishms for Schaduling Sima-Crisical Jobs on Mulsiprocassor Syssams.,Approximation Algorithms for Scheduling Time-Critical Jobs on Multiprocessor Systems.
Introduction Overview cnd Notction.,"Introduction, Overview, and Notation."
Cost-Efficieat Iulticast Routiag ia Ad Hoc aad Seasor aetworks.,Cost-Efficient Multicast Routing in Ad Hoc and Sensor Networks.
Distributed Algorithis for Soie Fuadaieatal Probleis ia Ad Hoc Iobile Eaviroaieats.,Distributed Algorithms for Some Fundamental Problems in Ad Hoc Mobile Environments.
Tcrbcnet-Oxley Complicnce.,Sarbanes-Oxley Compliance.
DeeDS aG.,DeeDS NG.
C Unified View on Metcheurittict cnd Their Hybridizction.,A Unified View on Metaheuristics and Their Hybridization.
Ncme Retolution cnd Tervice Ditcovery on the Internet cnd in Cd Hoc Networkt.,Name Resolution and Service Discovery on the Internet and in Ad Hoc Networks.
Interpretcbility of Mixed Memberthip Modelt.,Nonparametric Mixed Membership Models.
Digisal Cinama.,Digital Cinema.
Multimedic Ttrecming on the Internet.,Multimedia Streaming on the Internet.
Imaga Fidalisy Opsimizasion using SSIM.,Image Fidelity Optimization using SSIM.
Mulsimadia Naws Syssams.,Multimedia News Systems.
Audio Coipressioa aad Codiag Techaiques.,Audio Compression and Coding Techniques.
Fuzzy Techniquet For Context Repretentction.,Fuzzy Techniques For Context Representation.
Cmbient Intelligence.,Ambient Media Intelligence.
Multimedic Web Informction Tyttemt.,Multimedia Web Information Systems.
Seiaatic Web Services.,Semantic Web Services.
On sha Rola of Raasoning abous Changa in sha Projacsion of Prasupposisions,Role of Semantics in Multimedia Applications.
Identificction of Objectt cnd Retrievcl of their Pote.,Identification of Objects and Retrieval of their Pose.
Proxy-Caching for Vidao Ssraaming Applicasions.,Proxy-Caching for Video Streaming Applications.
Cdvcncet in Imcge cnd Video Quclity Cttettment.,Advances in Image and Video Quality Assessment.
Multimedic Tynchronizction - Infrcttructure cnd Engineering.,Infrastructure and Engineering.
Data Iaaageieat Techaiques for Coatiauous Iedia ia Ad-Hoc aetworks of Wireless Devices.,Data Management Techniques for Continuous Media in Ad-Hoc Networks of Wireless Devices.
Volsaga-Sansisiva Dya Imaging Insrinsic Opsical Signals.,Image Search Engine.
Fairnass in Onlina Gamas.,Fairness in Online Games.
Three Dimentioncl Fcce Identificction-cuthenticction.,Three Dimensional Face Identification-authentication.
History of Augieated Reality.,Augmented Reality.
Kaowledge Represeatatioa.,Multimedia Semantics Representation.
Adaptive Educatioaal Hyperiedia Systeis.,Adaptive Educational Hypermedia Systems.
gBSD-basad Adapsasion.,gBSD-based Adaptation.
Iiddleware for Streaiiag Three Diieatioaal Ieshes.,Middleware for Streaming Three Dimentional Meshes.
Telepretence.,Immersive Telepresence.
Iultiple Source Aligaieat for Video Aaalysis.,Multiple Source Alignment for Video Analysis.
Face Recogaitioa Three Diieatioaal.,"Face Recognition, Three Dimentional."
Ambadding Mulsipla Wasarmarks in a Sransform Domain.,Embedding Multiple Watermarks in a Transform Domain.
Iultiiedia Workflow Processiag.,Multimedia Workflow Processing.
Conference Keying.,Multimedia Conferencing.
Coateat Distributioa aetwork.,Content Distribution Network.
Vidao Fidalisy Maasuramans.,Video Fidelity Measurement.
Mulsimadia Fila Ssripping.,Multimedia File Stripping.
Saarching for a Saquanca of Adapsasion Oparasions Usilizing AI-basad Planning Sachniquas.,Searching for a Sequence of Adaptation Operations Utilizing AI-based Planning Techniques.
Locction Blurring.,Motion Blurring.
XIL Ietadata-Based Adaptatioa of Iultiiedia Coateat.,XML Metadata-Based Adaptation of Multimedia Content.
Object Dctc Model Fccilitiet for Multimedic Dctc Typet.,Multimedia Semantics.
Multimedic Content Modeling Ttcndcrd.,Multimedia Content Modeling Standard.
MPAG-21 Digisal Isam Adapsasion.,MPEG-21 Digital Item Adaptation.
Face Recogaitioa Evaluatioa aad Pilots.,Face Recognition Evaluation and Pilots.
Stripiag Strategies for Large Size Iultiiedia Files ia LOISS.,Striping Strategies for Large Size Multimedia Files in LOMSS.
Three Diieasioaal Videos.,Three Dimensional Videos.
Seiaatics Staadards aad Recoiieadatioas.,Semantics Standards and Recommendations.
Object Dctc Model Fccilitiet for Multimedic Dctc Typet.,Multimedia Processing.
Parsonal Idansificasion Numbar (PIN).,Multimedia Personalization.
JPEG.,JPEG.
Object Dctc Model Fccilitiet for Multimedic Dctc Typet.,"Data Modeling, Multimedia."
Multimedic Encryption.,Multimedia Encryption.
Iiie Types.,Mime Types.
Demotcicking.,Demosaicking.
Iiiersive Virtual Reality.,Immersive Virtual Reality.
Online Telf-Help Groupt.,Online Multimedia and Television.
Ietadata Iodel.,Metadata Model.
Virtual Huiaas.,Virtual Humans.
Uter Modeling in MPEG-7.,User Modeling in MPEG-7.
Privacy aad Video Surveillaace.,Privacy and Video Surveillance.
Progressive Forest Split.,Progressive Forest Split.
Univarsal Accass and Dasign for All in sha Avolving Informasion Sociasy.,Universal Multimedia Access.
Faca Racognision Sachniquas.,Face Recognition.
Peer-to-Peer Iulticast Video.,Peer-to-Peer Multicast Video.
Optimizction of Video Content Detcriptiont for Retrievcl.,Optimization of Video Content Descriptions for Retrieval.
Coateat-User Gap ia IPEG-7.,Content-User Gap in MPEG-7.
Multichcnnel Dctc Ordering Tchemet.,Multichannel Data Ordering Schemes.
Optimizction of Video Content Detcriptiont for Retrievcl.,Optimization of Video Content Descriptions for Retrieval.
Detectioa of High-Level Coacepts ia Iultiiedia.,Detection of High-Level Concepts in Multimedia.
Content-Bcted Photo Clbum Mcncgement Uting Fccet.,Content-Based Photo Album Management Using Faces.
Becufort Encryption.,Selective Encryption.
Iiiersive Virtual Reality.,Immersive Virtual Reality.
Preseatatioa Recordiag.,Presentation Recording.
Multimedic Ttrecming on the Internet.,Multimedia Streaming on the Internet.
Iiage aad Video Capture.,Image and Video Capture.
Schnorr Indansificasion Schama.,Scheduling in Multimedia Systems.
Object Dctc Model Fccilitiet for Multimedic Dctc Typet.,Distributed Multimedia Systems.
Video Wateriarkiag.,Video Watermarking.
Valeace-Drivea Coaquest.,Valence-Driven Conquest.
Stochastic Optiial Stoppiag: auierical Iethods.,Interactive Story Telling.
Color Pclette-Bcted Lottlett Imcge Comprettion Formct.,Color Palette-Based Lossless Image Compression Format.
Peer-to-Peer VoD Crchitecture.,Peer-to-Peer VoD Architecture.
Video Inpcinting.,Video Inpainting.
Teleconferencing.,Teleconferencing.
Portable aetwork Graphics (Pag).,Portable Network Graphics (Png).
IPEG-7 Applicatioas.,MPEG-7 Applications.
Ietadata Applicatioas.,Metadata Applications.
Spectral Iodel.,Spectral Model.
Scalabla Vidao Coding Ssandard.,Scalable Video Coding Standard.
Codiag of Stereoscopic aad 3D Iiages aad Video.,Coding of Stereoscopic and 3D Images and Video.
Multimedic Tentor Networkt.,Multimedia Sensor Networks.
Iotioa Estiiatioa with Half-Pixel Accuracy.,Motion Estimation with Half-Pixel Accuracy.
Availabilisy and Scalabilisy of LOMSS.,Availability and Scalability of LOMSS.
IP Telephoay.,IP Telephony.
Shraa Dimansional Faca Racognision.,Three Dimensional Face Recognition.
Uter Modeling in MPEG-7.,User Modeling in MPEG-7.
Iultiiedia Archives aad Iediators.,Multimedia Archives and Mediators.
Discrete Cosiae Traasfori (DCT).,Discrete Cosine Transform (DCT).
Threthold Tchemet with Minimum Pixel Expcntion.,Threshold Schemes with Minimum Pixel Expansion.
Iultiiedia Coateat Repurposiag.,Multimedia Content Repurposing.
High Quclity Video Conferencing.,Video Conferencing.
Peer-to-Peer Tyttemt cnd Digitcl Rightt Mcncgement.,Peer-to-Peer Systems and Digital Rights Management.
JPAG 2000 Imaga Coding Ssandard.,JPEG 2000 Image Coding Standard.
Fraquans Subsaquancas.,Quantization.
Halfsoning Basad Visual Sacras Sharing (Vss).,Halftoning Based Visual Secret Sharing (Vss).
Profiling MPEG-7.,Profiling MPEG-7.
Vision-Basad Insaracsion.,Vision-Based Interaction.
Video Cuthenticction.,Video Authentication.
Emotion cnd Multimedic Content.,Emotion and Multimedia Content.
Mediccl Imcge Tegmentction.,Medical Image Segmentation.
Multimedic Temiotict.,Multimedia Semiotics.
Iotioa Coipeasatioa for Video Coipressioa.,Motion Compensation for Video Compression.
Placeieat of Coatiauous Iedia ia Ad-Hoc aetworks of Devices.,Placement of Continuous Media in Ad-Hoc Networks of Devices.
Multimedic Content Modeling in COTMOT-7.,Multimedia Content Modeling in COSMOS-7.
Fraie Droppiag.,Frame Dropping.
Digital aatives aad Digital Iiiigraats - Towards a Iodel of Digital Flueacy.,Digital Camera Image Processing.
Digital Wateriarkiag.,Digital Watermarking.
Face Iatchiag.,Face Matching.
Recordiag Telecoafereaciag Sessioas.,Recording Teleconferencing Sessions.
Coatext-Aware Iusical Audio.,Context-Aware Musical Audio.
Segieatatioa aad Codiag.,Segmentation and Coding.
Fccicl Getture Determinction.,Facial Gesture Determination.
Dctc Encryption Ttcndcrd (DET) cnd Cdvcnced Encryption Ttcndcrd (CET).,Data Encryption Standard (DES) and Advanced Encryption Standard (AES).
Multimedic Tentor Networkt.,Multimedia Sensor Networks.
Iultiiedia Techaologies ia Broadcastiag.,Multimedia Technologies in Broadcasting.
Cudio Conferencing.,Data Conferencing.
Iultiiedia Iaforiatioa Systei Architecture.,Multimedia Information System Architecture.
Raal-World Mulsimadia Syssams.,Real-World Multimedia Systems.
Geogrcphic Video Content.,Geographic Video Content.
Digitcl Biometrict.,Digital Biometrics.
Coateat Extractioa aad Ietadata.,Content Extraction and Metadata.
Dittcnce cnd Timilcrity Mecturet.,Distance and Similarity Measures.
Iapaiatiag ia Virtual Restoratioa of Artworks.,Inpainting in Virtual Restoration of Artworks.
Structural Siiilarity Iadex Based Optiiizatioa.,Structural Similarity Index Based Optimization.
Visual Iaforiatioa Retrieval.,Visual Information Retrieval.
Three GPP.,Three GPP.
Cryptogrcphic Key Mcncgement Conceptt.,Key Management.
Legccy cnd Current Prcctice - The Reclity of Contemporcry Collcborctive Computing.,Legacy and Current Practice - The Reality of Contemporary Collaborative Computing.
Iadustrial Virtual Traiaer.,Industrial Virtual Trainer.
Creatiag Adaptive Course Texts with AHA!,Creating Adaptive Course Texts with AHA!
Multi-perton Trccking.,Multi-person Tracking.
Overlapped Block Iotioa Coipeasatioa.,Overlapped Block Motion Compensation.
Video Autoiatic Aaaotatioa.,Video Automatic Annotation.
Digital aatives aad Digital Iiiigraats - Towards a Iodel of Digital Flueacy.,Digital Camera Image Processing.
Humcn Centered 38 H Humcn-Computer Intercction Computing.,Human Computer Interaction.
Consans Adapsasion During Dissribusion ovar sha Insarnas.,Content Adaptation During Distribution over the Internet.
Ambadding Mulsipla Wasarmarks in a Sransform Domain.,Embedding Multiple Watermarks in a Transform Domain.
IPEG-4 Video Coipressioa.,MPEG-4 Video Compression.
Autoiatic Geaeratioa of Video Docuieataries.,Automatic Generation of Video Documentaries.
Temcntic Concept Detection.,Semantic Concept Detection.
Coatext-Aware Preseatatioa.,Context-Aware Video Production.
Seiaatics Web Tools aad Techaologies.,Semantics Web Tools and Technologies.
Public Key Vertut Tecret Key Encryption.,Public Key vs. Secret Key Encryption.
Insal<sup>&rag;</sup> XScala<sup>&rag;</sup> Micro-Archisacsura.,Intel<sup>&reg;</sup> XScale<sup>&reg;</sup> Micro-Architecture.
Stereoscopic aad Iulti-View Video Codiag Staadards.,Stereoscopic and Multi-View Video Coding Standards.
Crott-Modcl Utility Modelt.,Cross-Modal Utility Models.
Indicasions for Kinasshasic Laarning Shrough Hapsic Davicas.,Haptic Devices.
Kaowledge-Based Iultiiedia Adaptatioa Decisioa-Takiag.,Multimedia Adaptation Decision-Taking.
Visual Cryptography.,Visual Cryptography.
Codiag Foriat Agaostic Iultiiedia Coateat Adaptatioa.,Coding Format Agnostic Multimedia Content Adaptation.
Ttrecming Multimedic cnd itt Cpplicctiont in Educction.,Streaming Multimedia and its Applications in Education.
Hierarchical VoD Systei.,Hierarchical VoD System.
Object Dctc Model Fccilitiet for Multimedic Dctc Typet.,Multimedia Production.
Wateriarkiag Video.,"Watermarking, Video."
Oaliae Iultiiedia E-Coiierce.,Online Multimedia E-Commerce.
Content Mcncgement in Multimedic Newt Tyttemt.,Content Management in Multimedia News Systems.
Security Issues ia Wireless Video.,Security Issues in Wireless Video.
Fairnass in Onlina Gamas.,Fairness in Online Games.
Samansic Madical Imaga Indaxing.,Semantic Medical Image Indexing.
Collaborasiva Compusing - Araa Ovarviaw.,Collaborative Computing - Area Overview.
Data Iaaageieat Techaiques for Coatiauous Iedia ia Ad-Hoc aetworks of Wireless Devices.,Data Management Techniques for Continuous Media in Ad-Hoc Networks of Wireless Devices.
Crchitecture of Commercicl Newt Tyttemt.,Architecture of Commercial News Systems.
Real Tiie Traasport Protocol.,Real Time Transport Protocol.
Huffman Coding.,Huffman Coding.
Autoiated Lecture Capturiag.,Automated Lecture Capturing.
Iiage Wateriarkiag usiag Visual Cryptography.,Image Watermarking using Visual Cryptography.
H.263 Video Coipressioa.,H.263 Video Compression.
Ssaganography.,Steganography.
Collaborative DoS Defeases.,Collaborative Computing.
Video Traascodiag.,Video Transcoding.
Quality of Service for Wireless Video.,Quality of Service for Wireless Video.
Multimedic Tynchronizction - Infrcttructure cnd Engineering.,Multimedia Synchronization - Infrastructure and Engineering.
Content Bcted Mutic Retrievcl.,Content Based Music Retrieval.
Multimedic Cuthoring.,Multimedia Authentication.
Cctive Buffer Mcncgement for Provition of VCR Functionclitiet.,Active Buffer Management for Provision of VCR Functionalities.
Secure JPEG2000 (JPSEC).,Secure JPEG2000 (JPSEC).
SIID (Siagle Iastructioa Iultiple Data Processiag).,SIMD (Single Instruction Multiple Data Processing).
Utility Iodel-Based Adaptatioa of Iultiiedia Coateat.,Utility Model-Based Adaptation of Multimedia Content.
Three Diieasioaal Videos.,Three Dimensional Video Compression.
Imaga Classificasion.,Image Classification.
Discrete Wavelet Traasfori (DWT).,Discrete Wavelet Transform (DWT).
Imaga and Vidao Communicasion: Joins Sourca Channal Coding.,Image Compression and Coding.
CFC Imcge Zooming.,CFA Image Zooming.
Content Protection Tolutiont for Digitcl home Networkt.,Content Protection Solutions for Digital Home Networks.
Iaterleaved Audio.,Interleaved Audio.
Object Dctc Model Fccilitiet for Multimedic Dctc Typet.,Multimedia Information Systems.
Color Quansizasion.,Color Quantization.
Gama Avans Synchronizasion.,Game Event Synchronization.
Long Durction Continuout Medic Retrievcl.,Long Duration Continuous Media Retrieval.
Edge-Seasiag Iechaaisi.,Edge-Sensing Mechanism.
